{
  "contract": "agentgov.evidence-freshness",
  "schema_version": "1.0",
  "evidence_id": "current-evaluation-baseline",
  "applicability": {
    "status": "applicable",
    "reason": null
  },
  "evidence_refs": [
    "evaluation/fixtures/baseline-ready/evaluation-manifest.json"
  ],
  "review": {
    "reviewed_at": "2026-07-01",
    "review_due_on": "2026-10-01"
  },
  "validity": {
    "expires_on": "2027-01-01",
    "policy_status": "current",
    "policy_ref": "evaluation/readiness-policy.md"
  },
  "invalidation": {
    "declared_events": [
      "evaluation-policy-changed",
      "baseline-replaced"
    ],
    "observed_events": []
  }
}
